{
  "$schema": "https://json-schema.org/draft/2020-12/schema",
  "$id": "urn:ethos:schema:milestone-e-internal-trust-loop-blocker-ledger:1",
  "title": "Ethos Milestone E internal trust-loop blocker ledger",
  "description": "Source-only pre-alpha Milestone E prep ledger for tracking explicit blockers from the internal trust-loop rehearsal evidence matrix. This validates ledger shape and vocabulary; source artifact alignment stays in the repository guard.",
  "type": "object",
  "required": [
    "schema_version",
    "status",
    "scope",
    "applies_to_inventory",
    "applies_to_criteria",
    "applies_to_walkthrough",
    "applies_to_protocol",
    "applies_to_matrix",
    "ledger_boundary",
    "ledger_status",
    "promotion_status",
    "public_boundary",
    "blocked_outputs",
    "evidence_matrix_lanes",
    "required_before_blocker_resolution",
    "blocker_rows"
  ],
  "additionalProperties": false,
  "properties": {
    "schema_version": { "const": 1 },
    "status": { "const": "source-only-pre-alpha-internal-milestone-e-prep" },
    "scope": { "const": "internal_trust_loop_blocker_ledger" },
    "applies_to_inventory": { "const": "docs/milestone-e-fixture-candidates.json" },
    "applies_to_criteria": { "const": "docs/milestone-e-fixture-promotion-criteria.json" },
    "applies_to_walkthrough": {
      "const": "docs/milestone-e-internal-trust-loop-walkthrough.json"
    },
    "applies_to_protocol": {
      "const": "docs/milestone-e-internal-trust-loop-use-protocol.json"
    },
    "applies_to_matrix": {
      "const": "docs/milestone-e-internal-trust-loop-rehearsal-evidence-matrix.json"
    },
    "ledger_boundary": { "const": "internal_source_only_blocker_ledger" },
    "ledger_status": { "const": "internal_source_only_blocker_ledger_defined_not_resolved" },
    "promotion_status": { "const": "not_promoted_beyond_internal_fixture_planning" },
    "public_boundary": {
      "type": "array",
      "minItems": 10,
      "maxItems": 10,
      "items": { "$ref": "#/$defs/public_boundary" },
      "uniqueItems": true
    },
    "blocked_outputs": {
      "type": "array",
      "minItems": 13,
      "maxItems": 13,
      "items": { "$ref": "#/$defs/blocked_output" },
      "uniqueItems": true
    },
    "evidence_matrix_lanes": {
      "type": "array",
      "minItems": 4,
      "maxItems": 4,
      "items": { "$ref": "#/$defs/evidence_matrix_lane" },
      "uniqueItems": true
    },
    "required_before_blocker_resolution": {
      "type": "array",
      "minItems": 5,
      "maxItems": 5,
      "items": { "$ref": "#/$defs/blocker_resolution_requirement" },
      "uniqueItems": true
    },
    "blocker_rows": {
      "type": "array",
      "minItems": 9,
      "maxItems": 9,
      "items": { "$ref": "#/$defs/blocker_row" }
    }
  },
  "$defs": {
    "blocker_row": {
      "type": "object",
      "required": [
        "step_id",
        "sequence",
        "candidate_id",
        "promotion_status",
        "validation_command_must_pass",
        "required_input_fixtures",
        "diagnostic_boundary_must_remain",
        "evidence_matrix_lanes",
        "explicit_blockers_must_remain",
        "global_blocked_outputs_must_remain"
      ],
      "additionalProperties": false,
      "properties": {
        "step_id": {
          "type": "string",
          "pattern": "^[a-z0-9]+(?:-[a-z0-9]+)*$"
        },
        "sequence": { "type": "integer", "minimum": 1, "maximum": 9 },
        "candidate_id": {
          "enum": [
            "native-verification-trust-loop",
            "split-quote-unsupported-claim-diagnostics",
            "capability-downgrade-diagnostics",
            "opendataloader-style-adapter-grounding",
            "pinned-real-opendataloader-fixture-path",
            "crop-descriptor-source-bound-crop-shape",
            "rag-chunk-artifact-loop",
            "security-report-artifact-loop",
            "demo-narrative-index"
          ]
        },
        "promotion_status": { "const": "not_promoted_beyond_internal_fixture_planning" },
        "validation_command_must_pass": { "$ref": "#/$defs/validation_command" },
        "required_input_fixtures": {
          "type": "array",
          "minItems": 1,
          "items": { "$ref": "#/$defs/repo_path" },
          "uniqueItems": true
        },
        "diagnostic_boundary_must_remain": { "type": "string", "minLength": 1 },
        "evidence_matrix_lanes": {
          "type": "array",
          "minItems": 4,
          "maxItems": 4,
          "items": { "$ref": "#/$defs/evidence_matrix_lane" },
          "uniqueItems": true
        },
        "explicit_blockers_must_remain": {
          "type": "array",
          "minItems": 1,
          "items": { "type": "string", "minLength": 1 },
          "uniqueItems": true
        },
        "global_blocked_outputs_must_remain": {
          "type": "array",
          "minItems": 13,
          "maxItems": 13,
          "items": { "$ref": "#/$defs/blocked_output" },
          "uniqueItems": true
        }
      }
    },
    "repo_path": {
      "type": "string",
      "minLength": 1,
      "pattern": "^(?:docs/demos/|examples/|fixtures/|schemas/)[A-Za-z0-9_./-]+$"
    },
    "validation_command": {
      "enum": [
        "make milestone-d-capability-downgrade-contract",
        "make milestone-d-internal-contracts",
        "make milestone-d-opendataloader-adapter-shape-contract",
        "make rag-chunk-alpha",
        "make security-report-alpha",
        "make verify-alpha"
      ]
    },
    "public_boundary": {
      "enum": [
        "public reports remain blocked",
        "release artifacts remain blocked",
        "package publication remains blocked",
        "hosted surfaces remain blocked",
        "public result wording remains blocked",
        "performance claims remain blocked",
        "quality claims remain blocked",
        "footprint claims remain blocked",
        "table-quality claims remain blocked",
        "parser-quality claims remain blocked"
      ]
    },
    "blocked_output": {
      "enum": [
        "public reports",
        "public result wording",
        "hosted surfaces",
        "release artifacts",
        "package publication",
        "production positioning",
        "benchmark publication",
        "performance claims",
        "quality claims",
        "footprint claims",
        "table-quality claims",
        "parser-quality claims",
        "broad demo-generation workflows"
      ]
    },
    "evidence_matrix_lane": {
      "enum": [
        "evidence grounding",
        "diagnostics",
        "fixture/evaluator validation",
        "explicit blockers"
      ]
    },
    "blocker_resolution_requirement": {
      "enum": [
        "blocker remains explicit in the source tree",
        "resolution requires a later source-only decision",
        "public-facing use remains blocked until claim-audit and release-scope decisions",
        "make milestone-e-prep remains green",
        "public-surface posture and claims gates remain green"
      ]
    }
  }
}
