{
  "schema_version": 1,
  "status": "source-only-pre-alpha-internal-milestone-e-prep",
  "scope": "internal_trust_loop_blocker_ledger",
  "applies_to_inventory": "docs/milestone-e-fixture-candidates.json",
  "applies_to_criteria": "docs/milestone-e-fixture-promotion-criteria.json",
  "applies_to_walkthrough": "docs/milestone-e-internal-trust-loop-walkthrough.json",
  "applies_to_protocol": "docs/milestone-e-internal-trust-loop-use-protocol.json",
  "applies_to_matrix": "docs/milestone-e-internal-trust-loop-rehearsal-evidence-matrix.json",
  "ledger_boundary": "internal_source_only_blocker_ledger",
  "ledger_status": "internal_source_only_blocker_ledger_defined_not_resolved",
  "promotion_status": "not_promoted_beyond_internal_fixture_planning",
  "public_boundary": [
    "public reports remain blocked",
    "release artifacts remain blocked",
    "package publication remains blocked",
    "hosted surfaces remain blocked",
    "public result wording remains blocked",
    "performance claims remain blocked",
    "quality claims remain blocked",
    "footprint claims remain blocked",
    "table-quality claims remain blocked",
    "parser-quality claims remain blocked"
  ],
  "blocked_outputs": [
    "public reports",
    "public result wording",
    "hosted surfaces",
    "release artifacts",
    "package publication",
    "production positioning",
    "benchmark publication",
    "performance claims",
    "quality claims",
    "footprint claims",
    "table-quality claims",
    "parser-quality claims",
    "broad demo-generation workflows"
  ],
  "evidence_matrix_lanes": [
    "evidence grounding",
    "diagnostics",
    "fixture/evaluator validation",
    "explicit blockers"
  ],
  "required_before_blocker_resolution": [
    "blocker remains explicit in the source tree",
    "resolution requires a later source-only decision",
    "public-facing use remains blocked until claim-audit and release-scope decisions",
    "make milestone-e-prep remains green",
    "public-surface posture and claims gates remain green"
  ],
  "blocker_rows": [
    {
      "step_id": "native-grounding-baseline",
      "sequence": 1,
      "candidate_id": "native-verification-trust-loop",
      "promotion_status": "not_promoted_beyond_internal_fixture_planning",
      "validation_command_must_pass": "make verify-alpha",
      "required_input_fixtures": [
        "examples/verify/cases.json",
        "examples/verify/goldens/native_grounded_report.json"
      ],
      "diagnostic_boundary_must_remain": "Native quote, table-cell, and presence evidence checks over checked-in document JSON.",
      "evidence_matrix_lanes": [
        "evidence grounding",
        "diagnostics",
        "fixture/evaluator validation",
        "explicit blockers"
      ],
      "explicit_blockers_must_remain": [
        "public result wording",
        "public-report blockers"
      ],
      "global_blocked_outputs_must_remain": [
        "public reports",
        "public result wording",
        "hosted surfaces",
        "release artifacts",
        "package publication",
        "production positioning",
        "benchmark publication",
        "performance claims",
        "quality claims",
        "footprint claims",
        "table-quality claims",
        "parser-quality claims",
        "broad demo-generation workflows"
      ]
    },
    {
      "step_id": "diagnostic-boundary-check",
      "sequence": 2,
      "candidate_id": "split-quote-unsupported-claim-diagnostics",
      "promotion_status": "not_promoted_beyond_internal_fixture_planning",
      "validation_command_must_pass": "make verify-alpha",
      "required_input_fixtures": [
        "examples/verify/native_split_quote_citations.json",
        "examples/verify/native_non_v1_claims_citations.json"
      ],
      "diagnostic_boundary_must_remain": "Adjacent native text evidence matching and explicit unsupported non-v1 claim diagnostics.",
      "evidence_matrix_lanes": [
        "evidence grounding",
        "diagnostics",
        "fixture/evaluator validation",
        "explicit blockers"
      ],
      "explicit_blockers_must_remain": [
        "future claim-kind expansion"
      ],
      "global_blocked_outputs_must_remain": [
        "public reports",
        "public result wording",
        "hosted surfaces",
        "release artifacts",
        "package publication",
        "production positioning",
        "benchmark publication",
        "performance claims",
        "quality claims",
        "footprint claims",
        "table-quality claims",
        "parser-quality claims",
        "broad demo-generation workflows"
      ]
    },
    {
      "step_id": "capability-downgrade-boundary",
      "sequence": 3,
      "candidate_id": "capability-downgrade-diagnostics",
      "promotion_status": "not_promoted_beyond_internal_fixture_planning",
      "validation_command_must_pass": "make milestone-d-capability-downgrade-contract",
      "required_input_fixtures": [
        "examples/verify/capability_downgrade_v1_contract.json",
        "examples/verify/goldens/opendataloader_capability_limited_report.json"
      ],
      "diagnostic_boundary_must_remain": "Grounding-source capability limits surface as warnings and capability-blocked checks.",
      "evidence_matrix_lanes": [
        "evidence grounding",
        "diagnostics",
        "fixture/evaluator validation",
        "explicit blockers"
      ],
      "explicit_blockers_must_remain": [
        "missing source capabilities"
      ],
      "global_blocked_outputs_must_remain": [
        "public reports",
        "public result wording",
        "hosted surfaces",
        "release artifacts",
        "package publication",
        "production positioning",
        "benchmark publication",
        "performance claims",
        "quality claims",
        "footprint claims",
        "table-quality claims",
        "parser-quality claims",
        "broad demo-generation workflows"
      ]
    },
    {
      "step_id": "opendataloader-adapter-grounding",
      "sequence": 4,
      "candidate_id": "opendataloader-style-adapter-grounding",
      "promotion_status": "not_promoted_beyond_internal_fixture_planning",
      "validation_command_must_pass": "make milestone-d-opendataloader-adapter-shape-contract",
      "required_input_fixtures": [
        "examples/verify/opendataloader_adapter_shape_v1_contract.json",
        "examples/verify/opendataloader.json"
      ],
      "diagnostic_boundary_must_remain": "OpenDataLoader-style input shape maps to parser-neutral grounding metadata with deterministic adapter diagnostics.",
      "evidence_matrix_lanes": [
        "evidence grounding",
        "diagnostics",
        "fixture/evaluator validation",
        "explicit blockers"
      ],
      "explicit_blockers_must_remain": [
        "broader foreign-adapter hardening"
      ],
      "global_blocked_outputs_must_remain": [
        "public reports",
        "public result wording",
        "hosted surfaces",
        "release artifacts",
        "package publication",
        "production positioning",
        "benchmark publication",
        "performance claims",
        "quality claims",
        "footprint claims",
        "table-quality claims",
        "parser-quality claims",
        "broad demo-generation workflows"
      ]
    },
    {
      "step_id": "pinned-opendataloader-fixture-path",
      "sequence": 5,
      "candidate_id": "pinned-real-opendataloader-fixture-path",
      "promotion_status": "not_promoted_beyond_internal_fixture_planning",
      "validation_command_must_pass": "make verify-alpha",
      "required_input_fixtures": [
        "fixtures/foreign/opendataloader/real/manifest.json",
        "fixtures/foreign/opendataloader/real/expected.verification_report.json",
        "fixtures/foreign/opendataloader/real/expected.ungrounded.verification_report.json"
      ],
      "diagnostic_boundary_must_remain": "Pinned foreign output exercises grounded and ungrounded verification paths without public comparison wording.",
      "evidence_matrix_lanes": [
        "evidence grounding",
        "diagnostics",
        "fixture/evaluator validation",
        "explicit blockers"
      ],
      "explicit_blockers_must_remain": [
        "public comparison reports",
        "claim wording"
      ],
      "global_blocked_outputs_must_remain": [
        "public reports",
        "public result wording",
        "hosted surfaces",
        "release artifacts",
        "package publication",
        "production positioning",
        "benchmark publication",
        "performance claims",
        "quality claims",
        "footprint claims",
        "table-quality claims",
        "parser-quality claims",
        "broad demo-generation workflows"
      ]
    },
    {
      "step_id": "crop-descriptor-source-bound-shape",
      "sequence": 6,
      "candidate_id": "crop-descriptor-source-bound-crop-shape",
      "promotion_status": "not_promoted_beyond_internal_fixture_planning",
      "validation_command_must_pass": "make milestone-d-internal-contracts",
      "required_input_fixtures": [
        "examples/crop/crop_element_v1_contract.json",
        "examples/crop/crop_element_surface_shape_v1_contract.json"
      ],
      "diagnostic_boundary_must_remain": "Source-bound crop descriptor identity and callable CLI/Python surface shape remain tied to current request and descriptor schemas.",
      "evidence_matrix_lanes": [
        "evidence grounding",
        "diagnostics",
        "fixture/evaluator validation",
        "explicit blockers"
      ],
      "explicit_blockers_must_remain": [
        "Node crop surfaces",
        "MCP crop surfaces",
        "hosted crop surfaces",
        "sandbox-backed crop surfaces",
        "foreign-adapter crop surfaces"
      ],
      "global_blocked_outputs_must_remain": [
        "public reports",
        "public result wording",
        "hosted surfaces",
        "release artifacts",